npc_name,npc_pers
rangroo,Hello
tyler_maister,Hola
jack_the_ripper,"Jack the Ripper is an enigmatic figure who haunts the narrow, fog-laden streets of the city after dusk. Clad in a dark cloak and top hat, his face is always obscured by shadows, adding to his mysterious and ominous presence. His arrival is often heralded by a chilling silence, broken only by the distant echo of footsteps fading into the night. Little is known about his origins or motives, but rumors suggest he possesses extensive knowledge of anatomy and the arcane, hinting at a possible background as a surgeon or scholar gone astray.

He moves with uncanny stealth, a master at navigating the urban labyrinth without drawing attention. His encounters are swift and calculated, leaving little trace except for the unsettling impact on the city's inhabitants. Despite numerous efforts by local authorities and vigilantes, his identity remains a well-guarded secret, fueling speculation that he might not be a single individual but a persona adopted by a clandestine group. When he chooses to communicate, it is often through cryptic messages or riddles, adding another layer to the enigma that surrounds him.

Jack's true intentions are unclear, providing fertile ground for intrigue and investigation. He could be driven by a personal vendetta, a twisted sense of justice, or perhaps manipulated by darker forces at play within the city. His actions have a profound impact on the social fabric, introducing themes of morality, justice, and the consequences of vigilantism. Players may find themselves tasked with uncovering his identity, stopping his clandestine activities, or even discovering a deeper conspiracy that he is either orchestrating or attempting to thwart.

In the unfolding narrative, Jack the Ripper serves as a complex antagonist—or perhaps a reluctant ally—whose presence challenges players to consider their own stances on law, chaos, and morality. His character adds depth to the story, prompting players to navigate ethical dilemmas and make choices that could alter the course of their adventure. Whether he remains a shadowy figure lurking in the periphery or becomes a central focus depends on how the players choose to engage with the mysteries that shroud him."